{
  "$schema": "./verify.schema.json",
  "onlyRunWhenDirty": true,
  "failClosed": false,
  "maxOutputChars": 4000,
  "checks": [
    {
      "name": "typecheck",
      "command": "docker compose -f docker/docker-compose.yml run --rm --no-deps web npm run typecheck",
      "enabled": true,
      "description": "tsc --noEmit inside the web container. No Node required on the host."
    },
    {
      "name": "lint",
      "command": "docker compose -f docker/docker-compose.yml run --rm --no-deps web npm run lint",
      "enabled": true,
      "description": "ESLint inside the web container."
    },
    {
      "name": "test",
      "command": "docker compose -f docker/docker-compose.yml run --rm --no-deps web npm run test",
      "enabled": true,
      "description": "Vitest unit and component suite. E2E runs separately via the e2e service."
    },
    {
      "name": "build",
      "command": "docker compose -f docker/docker-compose.yml run --rm --no-deps web npm run build",
      "enabled": true,
      "description": "next build (standalone output)."
    },
    {
      "name": "api-lint",
      "command": "docker compose -f docker/docker-compose.yml run --rm --no-deps api uv run ruff check",
      "enabled": true,
      "description": "Ruff inside the api container. No Python required on the host."
    },
    {
      "name": "api-test",
      "command": "docker compose -f docker/docker-compose.yml run --rm api uv run pytest",
      "enabled": true,
      "description": "pytest unit and e2e against Postgres. Starts db; not --no-deps."
    },
    {
      "name": "backoffice-typecheck",
      "command": "docker compose -f docker/docker-compose.yml run --rm --no-deps backoffice npm run typecheck",
      "enabled": true,
      "description": "tsc --noEmit inside the backoffice container."
    },
    {
      "name": "backoffice-lint",
      "command": "docker compose -f docker/docker-compose.yml run --rm --no-deps backoffice npm run lint",
      "enabled": true,
      "description": "ESLint inside the backoffice container."
    },
    {
      "name": "backoffice-test",
      "command": "docker compose -f docker/docker-compose.yml run --rm --no-deps backoffice npm run test",
      "enabled": true,
      "description": "Vitest unit and component suite. No API required."
    },
    {
      "name": "backoffice-build",
      "command": "docker compose -f docker/docker-compose.yml run --rm --no-deps backoffice npm run build",
      "enabled": true,
      "description": "next build (standalone output) for the backoffice."
    }
  ]
}
